{
  "$schema": "http://json-schema.org/draft-06/schema",
  "type": "object",
  "properties": {
    "version": {
      "type": "string"
    },
    "success": {
      "type": "boolean"
    },
    "reason": {},
    "content": {
      "type": "object",
      "properties": {
        "docker": {
          "type": "object",
          "properties": {
            "config_command": {
              "type": "string"
            },
            "config_result": {
              "type": "string"
            },
            "status": {
              "type": "string"
            }
          }
        }
      }
    },
    "raw": {
      "type": "string"
    },
    "inputs": {
      "type": "object",
      "properties": {
        "netdevice_ids": {
          "type": "string"
        },
        "netdevice_config_cmd": {
          "type": "string"
        }
      }
    },
    "metrics": {
      "type": "object",
      "properties": {
        "version": {
          "type": "string"
        },
        "package": {
          "type": "string"
        },
        "package_version": {
          "type": "string"
        },
        "host": {
          "type": "string"
        },
        "execution_time_ms": {
          "type": "integer"
        },
        "timestamp": {
          "type": "string"
        }
      }
    }
  }
}